Enter password: ****
Welcome to the MySQL monitor.  Commands end with ; or \g.
Your MySQL connection id is 13
Server version: 8.0.30 MySQL Community Server - GPL

Copyright (c) 2000, 2022, Oracle and/or its affiliates.

Oracle is a registered trademark of Oracle Corporation and/or its
affiliates. Other names may be trademarks of their respective
owners.

Type 'help;' or '\h' for help. Type '\c' to clear the current input statement.

mysql> show databses;
ERROR 1064 (42000): You have an error in your SQL syntax; check the manual that corresponds to your MySQL server version for the right syntax to use near 'databses' at line 1
mysql> show db;
ERROR 1064 (42000): You have an error in your SQL syntax; check the manual that corresponds to your MySQL server version for the right syntax to use near 'db' at line 1
mysql> show databse;
ERROR 1064 (42000): You have an error in your SQL syntax; check the manual that corresponds to your MySQL server version for the right syntax to use near 'databse' at line 1
mysql> show databases;
+--------------------+
| Database           |
+--------------------+
| gl                 |
| information_schema |
| mysql              |
| performance_schema |
| sys                |
+--------------------+
5 rows in set (0.00 sec)

mysql> use gl;
Database changed
mysql> create table employ(eno int, ename varchar(20),sal float,ph varchar(20));
Query OK, 0 rows affected (0.01 sec)

mysql> show gl;
ERROR 1064 (42000): You have an error in your SQL syntax; check the manual that corresponds to your MySQL server version for the right syntax to use near 'gl' at line 1
mysql> gl;
ERROR 1064 (42000): You have an error in your SQL syntax; check the manual that corresponds to your MySQL server version for the right syntax to use near 'gl' at line 1
mysql> desc employ;
+-------+-------------+------+-----+---------+-------+
| Field | Type        | Null | Key | Default | Extra |
+-------+-------------+------+-----+---------+-------+
| eno   | int         | YES  |     | NULL    |       |
| ename | varchar(20) | YES  |     | NULL    |       |
| sal   | float       | YES  |     | NULL    |       |
| ph    | varchar(20) | YES  |     | NULL    |       |
+-------+-------------+------+-----+---------+-------+
4 rows in set (0.00 sec)

mysql> insert into employ(10,'Snehasis',45000,12345787);
ERROR 1064 (42000): You have an error in your SQL syntax; check the manual that corresponds to your MySQL server version for the right syntax to use near '10,'Snehasis',45000,12345787)' at line 1
mysql> insert into employ values(10,'Snehasis',45000,5786554778);
Query OK, 1 row affected (0.00 sec)

mysql> select 8;
+---+
| 8 |
+---+
| 8 |
+---+
1 row in set (0.00 sec)

mysql> select *;
ERROR 1096 (HY000): No tables used
mysql> select * from gl;
ERROR 1146 (42S02): Table 'gl.gl' doesn't exist
mysql> select * from employ;
+------+----------+-------+------------+
| eno  | ename    | sal   | ph         |
+------+----------+-------+------------+
|   10 | Snehasis | 45000 | 5786554778 |
+------+----------+-------+------------+
1 row in set (0.00 sec)

mysql> update employ set eno=20
    -> ;
Query OK, 1 row affected (0.01 sec)
Rows matched: 1  Changed: 1  Warnings: 0

mysql> select * from employ;
+------+----------+-------+------------+
| eno  | ename    | sal   | ph         |
+------+----------+-------+------------+
|   20 | Snehasis | 45000 | 5786554778 |
+------+----------+-------+------------+
1 row in set (0.00 sec)

mysql> create table Employee;
ERROR 4028 (HY000): A table must have at least one visible column.
mysql> create table Employee ( employee_id int, first_name varchar(20), last_name varchar(25),department_id int,salary double);
Query OK, 0 rows affected (0.03 sec)

mysql> insert into employee values(1,'Snehasis','Barat',20,45000.0);
Query OK, 1 row affected (0.01 sec)

mysql> select * from employee;
+-------------+------------+-----------+---------------+--------+
| employee_id | first_name | last_name | department_id | salary |
+-------------+------------+-----------+---------------+--------+
|           1 | Snehasis   | Barat     |            20 |  45000 |
+-------------+------------+-----------+---------------+--------+
1 row in set (0.00 sec)

mysql> insert into employee values(2,'Akash','Roy',25,47000.0);
Query OK, 1 row affected (0.00 sec)

mysql> select * from employee;
+-------------+------------+-----------+---------------+--------+
| employee_id | first_name | last_name | department_id | salary |
+-------------+------------+-----------+---------------+--------+
|           1 | Snehasis   | Barat     |            20 |  45000 |
|           2 | Akash      | Roy       |            25 |  47000 |
+-------------+------------+-----------+---------------+--------+
2 rows in set (0.00 sec)

mysql> insert into employee values(3,'Akshay','Sharma',35,null);
Query OK, 1 row affected (0.00 sec)

mysql> select * from employee;
+-------------+------------+-----------+---------------+--------+
| employee_id | first_name | last_name | department_id | salary |
+-------------+------------+-----------+---------------+--------+
|           1 | Snehasis   | Barat     |            20 |  45000 |
|           2 | Akash      | Roy       |            25 |  47000 |
|           3 | Akshay     | Sharma    |            35 |   NULL |
+-------------+------------+-----------+---------------+--------+
3 rows in set (0.00 sec)

mysql> insert into employee values((205 Shelley Higgins 110 12000.0),( 100 Steven King 90 24000.0));
ERROR 1064 (42000): You have an error in your SQL syntax; check the manual that corresponds to your MySQL server version for the right syntax to use near 'Shelley Higgins 110 12000.0),( 100 Steven King 90 24000.0))' at line 1
mysql> insert into employee values((205 ,'Shelley', 'Higgins', 110, 12000),(100 ,'Steven' ,'King', 90, 24000));
ERROR 1136 (21S01): Column count doesn't match value count at row 1
mysql> insert into employee values (205 ,'Shelley', 'Higgins', 110, 12000),(100 ,'Steven' ,'King', 90, 24000);
Query OK, 2 rows affected (0.00 sec)
Records: 2  Duplicates: 0  Warnings: 0

mysql> insertinto employee (101 'Jhonny' 'Kochhar', 90, 17000,
    ->
    ->  102 ,Lex ,De Haan ,90, 17000,
    ->
    ->  111 ,Ismael, Sciarra ,100, 7700,
    ->
    ->  112 ,Jose Manuel, Urman ,100, 7800,
    ->
    ->  204 ,Hermann, Baer 70 ,10000;
ERROR 1064 (42000): You have an error in your SQL syntax; check the manual that corresponds to your MySQL server version for the right syntax to use near 'insertinto employee (101 'Jhonny' 'Kochhar', 90, 17000,

 102 ,Lex ,De Haan ,90,' at line 1
mysql> insert into employee values (101 'Jhonny' 'Kochhar', 90, 17000),
    ->
    ->  (102 ,Lex ,De Haan ,90, 17000),
    ->
    ->  (111 ,Ismael, Sciarra ,100, 7700),
    ->
    ->  (112 ,Jose Manuel, Urman ,100, 7800),
    ->
    ->  (204 ,Hermann, Baer 70 ,10000);
ERROR 1064 (42000): You have an error in your SQL syntax; check the manual that corresponds to your MySQL server version for the right syntax to use near ''Jhonny' 'Kochhar', 90, 17000),

 (102 ,Lex ,De Haan ,90, 17000),

 (111 ,Ismael' at line 1
mysql> insert into (101 'Jhonny' 'Kochhar', 90, 17000),(102 ,Lex ,De Haan ,90, 17000),(111 ,Ismael, Sciarra ,100, 7700),
    -> (112 ,Jose Manuel, Urman ,100, 7800),(204 ,Hermann, Baer 70 ,10000);
ERROR 1064 (42000): You have an error in your SQL syntax; check the manual that corresponds to your MySQL server version for the right syntax to use near '(101 'Jhonny' 'Kochhar', 90, 17000),(102 ,Lex ,De Haan ,90, 17000),(111 ,Ismael,' at line 1
mysql> insert into employee values (101 'Jhonny' 'Kochhar', 90, 17000),
    ->
    ->  (102 ,'Lex' ,'De Haan' ,90, 17000),
    ->
    ->  (111 ,'Ismael', 'Sciarra' ,100, 7700),
    ->
    ->  (112 ,'Jose Manuel', 'Urman' ,100, 7800),
    ->
    ->  (204 ,'Hermann', 'Baer', 70 ,10000);
ERROR 1064 (42000): You have an error in your SQL syntax; check the manual that corresponds to your MySQL server version for the right syntax to use near ''Jhonny' 'Kochhar', 90, 17000),

 (102 ,'Lex' ,'De Haan' ,90, 17000),

 (111 ,'I' at line 1
mysql> insert inro employee values (101 'Jhonny' 'Kochhar', 90, 17000);
ERROR 1064 (42000): You have an error in your SQL syntax; check the manual that corresponds to your MySQL server version for the right syntax to use near 'employee values (101 'Jhonny' 'Kochhar', 90, 17000)' at line 1
mysql> insert into employee values (101 'Jhonny' 'Kochhar', 90, 17000);
ERROR 1064 (42000): You have an error in your SQL syntax; check the manual that corresponds to your MySQL server version for the right syntax to use near ''Jhonny' 'Kochhar', 90, 17000)' at line 1
mysql> (101 'Jhonny' ,'Kochhar', 90, 17000),
    ->
    ->  (102 ,'Lex' ,'De Haan' ,90, 17000),
    ->
    ->  (111 ,'Ismael', 'Sciarra' ,100, 7700),
    ->
    ->  (112 ,'Jose Manuel', 'Urman' ,100, 7800),
    ->
    ->  (204 ,'Hermann', 'Baer', 70 ,10000);
ERROR 1064 (42000): You have an error in your SQL syntax; check the manual that corresponds to your MySQL server version for the right syntax to use near '101 'Jhonny' ,'Kochhar', 90, 17000),

 (102 ,'Lex' ,'De Haan' ,90, 17000),

 (11' at line 1
mysql> insert into employee values (101 ,'Jhonny' ,'Kochhar', 90, 17000),
    ->
    ->  (102 ,'Lex' ,'De Haan' ,90, 17000),
    ->
    ->  (111 ,'Ismael', 'Sciarra' ,100, 7700),
    ->
    ->  (112 ,'Jose Manuel', 'Urman' ,100, 7800),
    ->
    ->  (204 ,'Hermann', 'Baer', 70 ,10000);
Query OK, 5 rows affected (0.00 sec)
Records: 5  Duplicates: 0  Warnings: 0

mysql> select * from employee;
+-------------+-------------+-----------+---------------+--------+
| employee_id | first_name  | last_name | department_id | salary |
+-------------+-------------+-----------+---------------+--------+
|           1 | Snehasis    | Barat     |            20 |  45000 |
|           2 | Akash       | Roy       |            25 |  47000 |
|           3 | Akshay      | Sharma    |            35 |   NULL |
|         205 | Shelley     | Higgins   |           110 |  12000 |
|         100 | Steven      | King      |            90 |  24000 |
|         101 | Jhonny      | Kochhar   |            90 |  17000 |
|         102 | Lex         | De Haan   |            90 |  17000 |
|         111 | Ismael      | Sciarra   |           100 |   7700 |
|         112 | Jose Manuel | Urman     |           100 |   7800 |
|         204 | Hermann     | Baer      |            70 |  10000 |
+-------------+-------------+-----------+---------------+--------+
10 rows in set (0.00 sec)

mysql> update salary set salary=salary+0.1*salary where department_id in 90;
ERROR 1064 (42000): You have an error in your SQL syntax; check the manual that corresponds to your MySQL server version for the right syntax to use near '90' at line 1
mysql> update salary set salary=salary+0.1*salary where department_id in (90);
ERROR 1146 (42S02): Table 'gl.salary' doesn't exist
mysql> update employee set salary=salary+0.1*salary where department_id in (90);
Query OK, 3 rows affected (0.00 sec)
Rows matched: 3  Changed: 3  Warnings: 0

mysql> select * from employee;
+-------------+-------------+-----------+---------------+--------+
| employee_id | first_name  | last_name | department_id | salary |
+-------------+-------------+-----------+---------------+--------+
|           1 | Snehasis    | Barat     |            20 |  45000 |
|           2 | Akash       | Roy       |            25 |  47000 |
|           3 | Akshay      | Sharma    |            35 |   NULL |
|         205 | Shelley     | Higgins   |           110 |  12000 |
|         100 | Steven      | King      |            90 |  26400 |
|         101 | Jhonny      | Kochhar   |            90 |  18700 |
|         102 | Lex         | De Haan   |            90 |  18700 |
|         111 | Ismael      | Sciarra   |           100 |   7700 |
|         112 | Jose Manuel | Urman     |           100 |   7800 |
|         204 | Hermann     | Baer      |            70 |  10000 |
+-------------+-------------+-----------+---------------+--------+
10 rows in set (0.00 sec)

mysql> insert into values (202, 'Pat' ,'Fay' ,20, (null)
    ->
    ->  203 ,'Susan' ,'Mavris', 40, (null));
ERROR 1064 (42000): You have an error in your SQL syntax; check the manual that corresponds to your MySQL server version for the right syntax to use near 'values (202, 'Pat' ,'Fay' ,20, (null)

 203 ,'Susan' ,'Mavris', 40, (null))' at line 1
mysql> (202, 'Pat' ,'Fay' ,20, (null),
    ->
    ->  (203 ,'Susan' ,'Mavris', 40, (null));
ERROR 1064 (42000): You have an error in your SQL syntax; check the manual that corresponds to your MySQL server version for the right syntax to use near '202, 'Pat' ,'Fay' ,20, (null),

 (203 ,'Susan' ,'Mavris', 40, (null))' at line 1
mysql> insert into employee values (202, 'Pat' ,'Fay' ,20, (null),
    ->
    ->  (203 ,'Susan' ,'Mavris', 40, (null));
ERROR 1064 (42000): You have an error in your SQL syntax; check the manual that corresponds to your MySQL server version for the right syntax to use near '' at line 3
mysql> insert into employee values (202, 'Pat' ,'Fay' ,20, (null),(203 ,'Susan','Mavris',40, (null));
ERROR 1064 (42000): You have an error in your SQL syntax; check the manual that corresponds to your MySQL server version for the right syntax to use near '' at line 1
mysql> insert into employee values (202,'Pat','Fay',20,(null),(203,'Susan','Mavris',40,(null));
ERROR 1064 (42000): You have an error in your SQL syntax; check the manual that corresponds to your MySQL server version for the right syntax to use near '' at line 1
mysql> insert into employee values (202,'Pat','Fay',20,(null));
Query OK, 1 row affected (0.00 sec)

mysql> insert into employee values (203,'Susan','Mavris',40,(null));
Query OK, 1 row affected (0.00 sec)

mysql> select * from employee;
+-------------+-------------+-----------+---------------+--------+
| employee_id | first_name  | last_name | department_id | salary |
+-------------+-------------+-----------+---------------+--------+
|           1 | Snehasis    | Barat     |            20 |  45000 |
|           2 | Akash       | Roy       |            25 |  47000 |
|           3 | Akshay      | Sharma    |            35 |   NULL |
|         205 | Shelley     | Higgins   |           110 |  12000 |
|         100 | Steven      | King      |            90 |  26400 |
|         101 | Jhonny      | Kochhar   |            90 |  18700 |
|         102 | Lex         | De Haan   |            90 |  18700 |
|         111 | Ismael      | Sciarra   |           100 |   7700 |
|         112 | Jose Manuel | Urman     |           100 |   7800 |
|         204 | Hermann     | Baer      |            70 |  10000 |
|         202 | Pat         | Fay       |            20 |   NULL |
|         203 | Susan       | Mavris    |            40 |   NULL |
+-------------+-------------+-----------+---------------+--------+
12 rows in set (0.00 sec)

mysql> update employee set last_name='Higgins' where emp_id=202;
ERROR 1054 (42S22): Unknown column 'emp_id' in 'where clause'
mysql> update employee set last_name='Higgins' where employee_id=202;
Query OK, 1 row affected (0.00 sec)
Rows matched: 1  Changed: 1  Warnings: 0

mysql> select * from employee;
+-------------+-------------+-----------+---------------+--------+
| employee_id | first_name  | last_name | department_id | salary |
+-------------+-------------+-----------+---------------+--------+
|           1 | Snehasis    | Barat     |            20 |  45000 |
|           2 | Akash       | Roy       |            25 |  47000 |
|           3 | Akshay      | Sharma    |            35 |   NULL |
|         205 | Shelley     | Higgins   |           110 |  12000 |
|         100 | Steven      | King      |            90 |  26400 |
|         101 | Jhonny      | Kochhar   |            90 |  18700 |
|         102 | Lex         | De Haan   |            90 |  18700 |
|         111 | Ismael      | Sciarra   |           100 |   7700 |
|         112 | Jose Manuel | Urman     |           100 |   7800 |
|         204 | Hermann     | Baer      |            70 |  10000 |
|         202 | Pat         | Higgins   |            20 |   NULL |
|         203 | Susan       | Mavris    |            40 |   NULL |
+-------------+-------------+-----------+---------------+--------+
12 rows in set (0.00 sec)

mysql> delete from employee where first_name like %man% or last_name like %man%;
ERROR 1064 (42000): You have an error in your SQL syntax; check the manual that corresponds to your MySQL server version for the right syntax to use near '%man% or last_name like %man%' at line 1
mysql> delete from employee where first_name like '%man%' or last_name like '%man%';
Query OK, 2 rows affected (0.00 sec)

mysql> select * from employee;
+-------------+------------+-----------+---------------+--------+
| employee_id | first_name | last_name | department_id | salary |
+-------------+------------+-----------+---------------+--------+
|           1 | Snehasis   | Barat     |            20 |  45000 |
|           2 | Akash      | Roy       |            25 |  47000 |
|           3 | Akshay     | Sharma    |            35 |   NULL |
|         205 | Shelley    | Higgins   |           110 |  12000 |
|         100 | Steven     | King      |            90 |  26400 |
|         101 | Jhonny     | Kochhar   |            90 |  18700 |
|         102 | Lex        | De Haan   |            90 |  18700 |
|         111 | Ismael     | Sciarra   |           100 |   7700 |
|         202 | Pat        | Higgins   |            20 |   NULL |
|         203 | Susan      | Mavris    |            40 |   NULL |
+-------------+------------+-----------+---------------+--------+
10 rows in set (0.00 sec)

mysql>